{"input": "For the past 9 years, I've been a quality assurance manager at TestPerfect. My skills include test strategy and team leadership. I'm Anil Kapoor, anil.k@example.com.", "target": {"name": "Anil Kapoor", "email": "anil.k@example.com", "skills": ["QA Management", "Test Strategy", "Team Leadership"], "experience": [{"company": "TestPerfect", "role": "Quality Assurance Manager", "years": 9.0}]}, "prediction": {}, "raw_output": "\nExtract structured information from the resume below into JSON with keys:\n[\"name\", \"email\", \"skills\", \"experience\"]\n\nResume:\n\nFor the past 9 years, I've been a quality assurance manager at TestPerfect. My skills include test strategy and team leadership. I'm Anil Kapoor, anil.k@example.com.\n\nOutput JSON:\n```json\n{\n  \"name\": \"Anil Kapoor\",\n  \"email\": \"anil.k@example.com\",\n  \"skills\": [\"test strategy\", \"team leadership\"],\n  \"experience\": [\n    {\n      \"name\": \"9 years\",\n      \"email\": \"anil.k@example.com\",\n      \"skills\": [\"test strategy\", \"team leadership\"],\n      \"experience\": [\n        {\n          \"name\": \"9 years\",\n          \"email\": \"anil.k@example.com\",\n          \"skills\": [\"test strategy\", \"team leadership\"],\n          \"experience\": [\n            {\n              \"name\": \"9 years\",\n              \"email\": \"anil.k@example.com\",\n              \"skills\": [\"test strategy\", \"team leadership\"],\n              \"experience\": [\n                {\n                  \"name\": \"9 years\",\n                  \"email\": \"anil.k@example.com\",\n                  \"skills\": [\"test strategy\", \"team leadership\"],\n                  \"experience\": [\n                    {\n                      \"name\": \"9 years\",\n                      \"email\": \"anil.k@example.com\",\n                      \"skills\": [\"test strategy\", \"team leadership\"],\n                      \"experience\": [\n                        {\n                          \"name\":"}
{"input": "Contact: Lavanya Krishnan, l.krishnan@webmail.com. I'm a Cloud Consultant with 6 years at CloudAdvisors, specializing in AWS migration and cost optimization.", "target": {"name": "Lavanya Krishnan", "email": "l.krishnan@webmail.com", "skills": ["Cloud Consulting", "AWS Migration", "Cost Optimization"], "experience": [{"company": "CloudAdvisors", "role": "Cloud Consultant", "years": 6.0}]}, "prediction": {}, "raw_output": "\nExtract structured information from the resume below into JSON with keys:\n[\"name\", \"email\", \"skills\", \"experience\"]\n\nResume:\n\nContact: Lavanya Krishnan, l.krishnan@webmail.com. I'm a Cloud Consultant with 6 years at CloudAdvisors, specializing in AWS migration and cost optimization.\n\nOutput JSON:\n{\n  \"name\": \"Lavanya Krishnan\",\n  \"email\": \"l.krishnan@webmail.com\",\n  \"skills\": [\"AWS\", \"AWS migration\", \"AWS optimization\"],\n  \"experience\": [\n    {\n      \"name\": \"AWS migration\",\n      \"email\": \"l.krishnan@webmail.com\",\n      \"skills\": [\"AWS\", \"AWS migration\", \"AWS optimization\"],\n      \"experience\": [\n        {\n          \"name\": \"AWS migration\",\n          \"email\": \"l.krishnan@webmail.com\",\n          \"skills\": [\"AWS\", \"AWS migration\", \"AWS optimization\"],\n          \"experience\": [\n            {\n              \"name\": \"AWS optimization\",\n              \"email\": \"l.krishnan@webmail.com\",\n              \"skills\": [\"AWS\", \"AWS optimization\", \"AWS optimization\"],\n              \"experience\": [\n                {\n                  \"name\": \"AWS optimization\",\n                  \"email\": \"l.krishnan@webmail.com\",\n                  \"skills\": [\"AWS\", \"AWS optimization\", \"AWS optimization\"],\n                  \"experience\": [\n                    {\n                      \"name\": \"AWS optimization\",\n                      \"email\": \"l.krishnan@webmail."}
{"input": "My name is Irrfan Khan (irrfan.k@example.com). I am a Principal Engineer with 15 years at CoreLogic, skilled in system design and mentoring.", "target": {"name": "Irrfan Khan", "email": "irrfan.k@example.com", "skills": ["System Design", "Mentoring", "Architecture", "Leadership"], "experience": [{"company": "CoreLogic", "role": "Principal Engineer", "years": 15.0}]}, "prediction": {}, "raw_output": "\nExtract structured information from the resume below into JSON with keys:\n[\"name\", \"email\", \"skills\", \"experience\"]\n\nResume:\n\nMy name is Irrfan Khan (irrfan.k@example.com). I am a Principal Engineer with 15 years at CoreLogic, skilled in system design and mentoring.\n\nOutput JSON:\n```json\n{\n  \"name\": \"Irrfan Khan\",\n  \"email\": \"irrfan.k@example.com\",\n  \"skills\": [\"system design\", \"mentoring\"],\n  \"experience\": [15, 15]\n}\n```"}
{"input": "Contact me at sajal.a@example.com. I'm Sajal Aly, a frontend developer with 2 years at Webify, specializing in JavaScript and CSS animations.", "target": {"name": "Sajal Aly", "email": "sajal.a@example.com", "skills": ["JavaScript", "CSS Animations", "Frontend Development"], "experience": [{"company": "Webify", "role": "Frontend Developer", "years": 2.0}]}, "prediction": {"name": "Sajal Aly", "email": "sa@example.com", "skills": ["JavaScript", "CSS"], "experience": [2, "Webify"]}, "raw_output": "\nExtract structured information from the resume below into JSON with keys:\n[\"name\", \"email\", \"skills\", \"experience\"]\n\nResume:\n\nContact me at sajal.a@example.com. I'm Sajal Aly, a frontend developer with 2 years at Webify, specializing in JavaScript and CSS animations.\n\nOutput JSON:\n{\n  \"name\": \"Sajal Aly\",\n  \"email\": \"sa@example.com\",\n  \"skills\": [\"JavaScript\", \"CSS\"],\n  \"experience\": [2, \"Webify\"]\n}"}
{"input": "Summary for Nitin Khanna: A 3D artist with 4 years at GameArt. Proficient in Maya, ZBrush, and Substance Painter. Email: nitin.k@mail.com.", "target": {"name": "Nitin Khanna", "email": "nitin.k@mail.com", "skills": ["3D Art", "Maya", "ZBrush", "Substance Painter"], "experience": [{"company": "GameArt", "role": "3D Artist", "years": 4.0}]}, "prediction": {"name": "Nitin Khanna", "email": "nitin.k@mail.com", "skills": ["Maya", "ZBrush", "Substance Painter"], "experience": [4, 4, 4]}, "raw_output": "\nExtract structured information from the resume below into JSON with keys:\n[\"name\", \"email\", \"skills\", \"experience\"]\n\nResume:\n\nSummary for Nitin Khanna: A 3D artist with 4 years at GameArt. Proficient in Maya, ZBrush, and Substance Painter. Email: nitin.k@mail.com.\n\nOutput JSON:\n{\n  \"name\": \"Nitin Khanna\",\n  \"email\": \"nitin.k@mail.com\",\n  \"skills\": [\"Maya\", \"ZBrush\", \"Substance Painter\"],\n  \"experience\": [4, 4, 4]\n}"}
{"input": "Raveena Tandon, a Content Designer at ContentShape for 4 years. She knows UX writing and content strategy. Email: raveena.t@example.com.", "target": {"name": "Raveena Tandon", "email": "raveena.t@example.com", "skills": ["Content Design", "UX Writing", "Content Strategy"], "experience": [{"company": "ContentShape", "role": "Content Designer", "years": 4.0}]}, "prediction": {"name": "Raveena Tandon", "email": "raveena.t@example.com", "skills": ["UX writing", "Content strategy"], "experience": [4, "4 years"]}, "raw_output": "\nExtract structured information from the resume below into JSON with keys:\n[\"name\", \"email\", \"skills\", \"experience\"]\n\nResume:\n\nRaveena Tandon, a Content Designer at ContentShape for 4 years. She knows UX writing and content strategy. Email: raveena.t@example.com.\n\nOutput JSON:\n{\n  \"name\": \"Raveena Tandon\",\n  \"email\": \"raveena.t@example.com\",\n  \"skills\": [\"UX writing\", \"Content strategy\"],\n  \"experience\": [4, \"4 years\"]\n}"}
{"input": "I'm a systems analyst. My name is Mrunal Thakur (mrunal.t@mail.com). For 6 years at SystemFlow, I've analyzed and improved IT systems.", "target": {"name": "Mrunal Thakur", "email": "mrunal.t@mail.com", "skills": ["Systems Analysis", "IT Systems", "Requirements Analysis"], "experience": [{"company": "SystemFlow", "role": "Systems Analyst", "years": 6.0}]}, "prediction": {}, "raw_output": "\nExtract structured information from the resume below into JSON with keys:\n[\"name\", \"email\", \"skills\", \"experience\"]\n\nResume:\n\nI'm a systems analyst. My name is Mrunal Thakur (mrunal.t@mail.com). For 6 years at SystemFlow, I've analyzed and improved IT systems.\n\nOutput JSON:\n```json\n{\n  \"name\": \"Mrunal Thakur\",\n  \"email\": \"mrunal.t@mail.com\",\n  \"skills\": [\"systems analyst\", \"analyst\"],\n  \"experience\": [\n    \"6 years\",\n    \"SystemFlow\"\n  ]\n}\n```"}
{"input": "I am a Senior DevOps Engineer at AutomateAll with 8 years experience. I'm proficient in Kubernetes, Terraform, and Azure DevOps. My name is Bobby Deol, bobby.d@inbox.com.", "target": {"name": "Bobby Deol", "email": "bobby.d@inbox.com", "skills": ["Kubernetes", "Terraform", "Azure DevOps", "CI/CD"], "experience": [{"company": "AutomateAll", "role": "Senior DevOps Engineer", "years": 8.0}]}, "prediction": {}, "raw_output": "\nExtract structured information from the resume below into JSON with keys:\n[\"name\", \"email\", \"skills\", \"experience\"]\n\nResume:\n\nI am a Senior DevOps Engineer at AutomateAll with 8 years experience. I'm proficient in Kubernetes, Terraform, and Azure DevOps. My name is Bobby Deol, bobby.d@inbox.com.\n\nOutput JSON:\n```json\n{\n  \"name\": \"Bobby Deol\",\n  \"email\": \"bobby.d@inbox.com\",\n  \"skills\": [\"Kubernetes\", \"Terraform\", \"Azure DevOps\"],\n  \"experience\": [8, 8, 8]\n}\n```"}
{"input": "Aftab Shivdasani, a.shivdasani@inbox.com, is a business process analyst. He worked for 4 years at ProcessPro and has skills in process mapping and optimization.", "target": {"name": "Aftab Shivdasani", "email": "a.shivdasani@inbox.com", "skills": ["Business Process Analysis", "Process Mapping", "Optimization"], "experience": [{"company": "ProcessPro", "role": "Business Process Analyst", "years": 4.0}]}, "prediction": {}, "raw_output": "\nExtract structured information from the resume below into JSON with keys:\n[\"name\", \"email\", \"skills\", \"experience\"]\n\nResume:\n\nAftab Shivdasani, a.shivdasani@inbox.com, is a business process analyst. He worked for 4 years at ProcessPro and has skills in process mapping and optimization.\n\nOutput JSON:\n```json\n{\n  \"name\": \"Aftab Shivdasani\",\n  \"email\": \"a.shivdasani@inbox.com\",\n  \"skills\": [\"process mapping and optimization\"],\n  \"experience\": [4]\n}\n```"}
{"input": "I am a Network Engineer with 11 years at ConnectAll Inc. My expertise includes Cisco, Juniper, and network security. Name: Sanjay Kumar. Email: sanjay.k@example.com.", "target": {"name": "Sanjay Kumar", "email": "sanjay.k@example.com", "skills": ["Cisco", "Juniper", "Network Security", "Routing"], "experience": [{"company": "ConnectAll Inc.", "role": "Network Engineer", "years": 11.0}]}, "prediction": {"name": "Sanjay Kumar", "email": "sanjay.k@example.com", "skills": ["Cisco", "Juniper", "network security"], "experience": [11, 11, 11]}, "raw_output": "\nExtract structured information from the resume below into JSON with keys:\n[\"name\", \"email\", \"skills\", \"experience\"]\n\nResume:\n\nI am a Network Engineer with 11 years at ConnectAll Inc. My expertise includes Cisco, Juniper, and network security. Name: Sanjay Kumar. Email: sanjay.k@example.com.\n\nOutput JSON:\n{\n  \"name\": \"Sanjay Kumar\",\n  \"email\": \"sanjay.k@example.com\",\n  \"skills\": [\"Cisco\", \"Juniper\", \"network security\"],\n  \"experience\": [11, 11, 11]\n}"}
{"input": "I'm a learning and development specialist. For 7 years at LearnUp, I've designed training programs and e-learning modules. - Kriti Sharma, kriti.s@webmail.com.", "target": {"name": "Kriti Sharma", "email": "kriti.s@webmail.com", "skills": ["L&D", "Training Programs", "E-learning", "Instructional Design"], "experience": [{"company": "LearnUp", "role": "L&D Specialist", "years": 7.0}]}, "prediction": {}, "raw_output": "\nExtract structured information from the resume below into JSON with keys:\n[\"name\", \"email\", \"skills\", \"experience\"]\n\nResume:\n\nI'm a learning and development specialist. For 7 years at LearnUp, I've designed training programs and e-learning modules. - Kriti Sharma, kriti.s@webmail.com.\n\nOutput JSON:\n```json\n{\n  \"name\": \"Kriti Sharma\",\n  \"email\": \"kriti.s@webmail.com\",\n  \"skills\": [\"training\", \"e-learning\"],\n  \"experience\": [7, 7]\n}\n```"}
{"input": "I'm a cybersecurity analyst. My name is Fatima Ahmed (f.ahmed@mail.com). I worked for 3 years at SecureNet and I am skilled in Wireshark, Metasploit, and Python.", "target": {"name": "Fatima Ahmed", "email": "f.ahmed@mail.com", "skills": ["Wireshark", "Metasploit", "Python", "Cybersecurity"], "experience": [{"company": "SecureNet", "role": "Cybersecurity Analyst", "years": 3.0}]}, "prediction": {}, "raw_output": "\nExtract structured information from the resume below into JSON with keys:\n[\"name\", \"email\", \"skills\", \"experience\"]\n\nResume:\n\nI'm a cybersecurity analyst. My name is Fatima Ahmed (f.ahmed@mail.com). I worked for 3 years at SecureNet and I am skilled in Wireshark, Metasploit, and Python.\n\nOutput JSON:\n```json\n{\n  \"name\": \"Fatima Ahmed\",\n  \"email\": \"f.ahmed@mail.com\",\n  \"skills\": [\"Wireshark\", \"Metasploit\", \"Python\"],\n  \"experience\": [3, 3, 3]\n}\n```"}
{"input": "My name is Tanishaa Mukerji, and I am a program manager. I have 10 years of experience at ProgramFlow and I am skilled in stakeholder management and planning. My email is tanishaa.m@email.com.", "target": {"name": "Tanishaa Mukerji", "email": "tanishaa.m@email.com", "skills": ["Program Management", "Stakeholder Management", "Planning"], "experience": [{"company": "ProgramFlow", "role": "Program Manager", "years": 10.0}]}, "prediction": {}, "raw_output": "\nExtract structured information from the resume below into JSON with keys:\n[\"name\", \"email\", \"skills\", \"experience\"]\n\nResume:\n\nMy name is Tanishaa Mukerji, and I am a program manager. I have 10 years of experience at ProgramFlow and I am skilled in stakeholder management and planning. My email is tanishaa.m@email.com.\n\nOutput JSON:\n```json\n{\n  \"name\": \"Tanishaa Mukerji\",\n  \"email\": \"tanishaa.m@email.com\",\n  \"skills\": [\"stakeholder management\", \"planning\"],\n  \"experience\": [10, \"10 years\"]\n}\n```"}
{"input": "For 6 years, I, Mahie Gill, have been a compensation analyst at PayScale Inc. My skills include salary benchmarking and job evaluation. Email: mahie.g@inbox.com.", "target": {"name": "Mahie Gill", "email": "mahie.g@inbox.com", "skills": ["Compensation Analysis", "Salary Benchmarking", "Job Evaluation"], "experience": [{"company": "PayScale Inc.", "role": "Compensation Analyst", "years": 6.0}]}, "prediction": {"name": "Mahie Gill", "email": "mahie.g@inbox.com", "skills": ["salary benchmarking and job evaluation"], "experience": [6]}, "raw_output": "\nExtract structured information from the resume below into JSON with keys:\n[\"name\", \"email\", \"skills\", \"experience\"]\n\nResume:\n\nFor 6 years, I, Mahie Gill, have been a compensation analyst at PayScale Inc. My skills include salary benchmarking and job evaluation. Email: mahie.g@inbox.com.\n\nOutput JSON:\n{\n  \"name\": \"Mahie Gill\",\n  \"email\": \"mahie.g@inbox.com\",\n  \"skills\": [\"salary benchmarking and job evaluation\"],\n  \"experience\": [6]\n}"}
{"input": "I'm an operations manager with 9 years at EffiCore. My skills are process improvement and team leadership. - Saif Ali Khan, saif.k@mail.com.", "target": {"name": "Saif Ali Khan", "email": "saif.k@mail.com", "skills": ["Operations Management", "Process Improvement", "Team Leadership", "Six Sigma"], "experience": [{"company": "EffiCore", "role": "Operations Manager", "years": 9.0}]}, "prediction": {"name": "Saif Ali Khan", "email": "saif.k@mail.com", "skills": ["process improvement", "team leadership"], "experience": [9, 9]}, "raw_output": "\nExtract structured information from the resume below into JSON with keys:\n[\"name\", \"email\", \"skills\", \"experience\"]\n\nResume:\n\nI'm an operations manager with 9 years at EffiCore. My skills are process improvement and team leadership. - Saif Ali Khan, saif.k@mail.com.\n\nOutput JSON:\n{\n  \"name\": \"Saif Ali Khan\",\n  \"email\": \"saif.k@mail.com\",\n  \"skills\": [\"process improvement\", \"team leadership\"],\n  \"experience\": [9, 9]\n}"}
{"input": "Aditya Joshi's resume: 12 years at Axiom Global as a Cloud Architect. Skills: AWS, Azure, Solution Design, and Microservices. Email me at aditya.joshi@mail.com.", "target": {"name": "Aditya Joshi", "email": "aditya.joshi@mail.com", "skills": ["AWS", "Azure", "Solution Design", "Microservices"], "experience": [{"company": "Axiom Global", "role": "Cloud Architect", "years": 12.0}]}, "prediction": {}, "raw_output": "\nExtract structured information from the resume below into JSON with keys:\n[\"name\", \"email\", \"skills\", \"experience\"]\n\nResume:\n\nAditya Joshi's resume: 12 years at Axiom Global as a Cloud Architect. Skills: AWS, Azure, Solution Design, and Microservices. Email me at aditya.joshi@mail.com.\n\nOutput JSON:\n```json\n{\n  \"name\": \"Aditya Joshi\",\n  \"email\": \"aditya.joshi@mail.com\",\n  \"skills\": [\"aws\", \"azure\", \"solution_design\", \"microservices\"],\n  \"experience\": [\n    {\n      \"name\": \"Cloud Architect\",\n      \"email\": \"aditya.joshi@mail.com\",\n      \"skills\": [\"aws\", \"azure\", \"solution_design\", \"microservices\"],\n      \"experience\": [\n        {\n          \"name\": \"12 years\",\n          \"email\": \"aditya.joshi@mail.com\",\n          \"skills\": [\"aws\", \"azure\", \"solution_design\", \"microservices\"],\n          \"experience\": [\n            {\n              \"name\": \"Cloud Architect\",\n              \"email\": \"aditya.joshi@mail.com\",\n              \"skills\": [\"aws\", \"azure\", \"solution_design\", \"microservices\"],\n              \"experience\": [\n                {\n                  \"name\": \"12 years\",\n                  \"email\": \"aditya.joshi@mail.com\",\n                  \"skills\": [\"aws\", \"azure\", \"solution_design\", \"microservices\"],\n                  \"experience\":"}
{"input": "My name is Smita Patil. I am a project coordinator at PlanRight. I worked for 2 years and I know MS Project and communication. smita.p@webmail.com", "target": {"name": "Smita Patil", "email": "smita.p@webmail.com", "skills": ["Project Coordination", "MS Project", "Communication", "Scheduling"], "experience": [{"company": "PlanRight", "role": "Project Coordinator", "years": 2.0}]}, "prediction": {}, "raw_output": "\nExtract structured information from the resume below into JSON with keys:\n[\"name\", \"email\", \"skills\", \"experience\"]\n\nResume:\n\nMy name is Smita Patil. I am a project coordinator at PlanRight. I worked for 2 years and I know MS Project and communication. smita.p@webmail.com\n\nOutput JSON:\n```json\n{\n  \"name\": \"Smita Patil\",\n  \"email\": \"smita.p@webmail.com\",\n  \"skills\": [\"project coordination\"],\n  \"experience\": [2]\n}\n```"}
{"input": "Currently a machine learning engineer at AI Forge for 3 years. My core skills are PyTorch, NLP, and Computer Vision. Contact me, Riya Singh, at riya.singh@email.com.", "target": {"name": "Riya Singh", "email": "riya.singh@email.com", "skills": ["PyTorch", "NLP", "Computer Vision", "Machine Learning"], "experience": [{"company": "AI Forge", "role": "Machine Learning Engineer", "years": 3.0}]}, "prediction": {"name": "Riya Singh", "email": "riya.singh@email.com", "skills": ["PyTorch", "NLP", "Computer Vision"], "experience": [3, 3, 3]}, "raw_output": "\nExtract structured information from the resume below into JSON with keys:\n[\"name\", \"email\", \"skills\", \"experience\"]\n\nResume:\n\nCurrently a machine learning engineer at AI Forge for 3 years. My core skills are PyTorch, NLP, and Computer Vision. Contact me, Riya Singh, at riya.singh@email.com.\n\nOutput JSON:\n{\n  \"name\": \"Riya Singh\",\n  \"email\": \"riya.singh@email.com\",\n  \"skills\": [\"PyTorch\", \"NLP\", \"Computer Vision\"],\n  \"experience\": [3, 3, 3]\n}"}
{"input": "For the past 4 years, I've been a materials scientist at MatSci Labs. My skills include materials characterization and SEM. I'm Saba Qamar, saba.q@inbox.com.", "target": {"name": "Saba Qamar", "email": "saba.q@inbox.com", "skills": ["Materials Science", "Materials Characterization", "SEM"], "experience": [{"company": "MatSci Labs", "role": "Materials Scientist", "years": 4.0}]}, "prediction": {}, "raw_output": "\nExtract structured information from the resume below into JSON with keys:\n[\"name\", \"email\", \"skills\", \"experience\"]\n\nResume:\n\nFor the past 4 years, I've been a materials scientist at MatSci Labs. My skills include materials characterization and SEM. I'm Saba Qamar, saba.q@inbox.com.\n\nOutput JSON:\n```json\n{\n  \"name\": \"Saba Qamar\",\n  \"email\": \"saba.q@inbox.com\",\n  \"skills\": [\"materials characterization and SEM\"],\n  \"experience\": [4, \"4 years\"]\n}\n```"}
{"input": "Manoj Tiwari is a technical support engineer with 2 years at HelpDesk Heroes. He is good at troubleshooting and customer service. manoj.t@webmail.com", "target": {"name": "Manoj Tiwari", "email": "manoj.t@webmail.com", "skills": ["Technical Support", "Troubleshooting", "Customer Service", "Zendesk"], "experience": [{"company": "HelpDesk Heroes", "role": "Technical Support Engineer", "years": 2.0}]}, "prediction": {"name": "Manoj Tiwari", "email": "manoj@helpdeskheroes.com", "skills": ["troubleshooting", "customer service"], "experience": [2, "2 years"]}, "raw_output": "\nExtract structured information from the resume below into JSON with keys:\n[\"name\", \"email\", \"skills\", \"experience\"]\n\nResume:\n\nManoj Tiwari is a technical support engineer with 2 years at HelpDesk Heroes. He is good at troubleshooting and customer service. manoj.t@webmail.com\n\nOutput JSON:\n{\n  \"name\": \"Manoj Tiwari\",\n  \"email\": \"manoj@helpdeskheroes.com\",\n  \"skills\": [\"troubleshooting\", \"customer service\"],\n  \"experience\": [2, \"2 years\"]\n}"}
{"input": "Contact me at anushka.s@example.com. I'm Anushka Sharma, a UI/UX designer with 3 years at DesignHub, specializing in user flows and prototyping.", "target": {"name": "Anushka Sharma", "email": "anushka.s@example.com", "skills": ["UI/UX Design", "User Flows", "Prototyping", "Figma"], "experience": [{"company": "DesignHub", "role": "UI/UX Designer", "years": 3.0}]}, "prediction": {"name": "Anushka Sharma", "email": "anushka.s@example.com", "skills": ["UI/UX designer", "Prototyping"], "experience": [3, "3 years at DesignHub"]}, "raw_output": "\nExtract structured information from the resume below into JSON with keys:\n[\"name\", \"email\", \"skills\", \"experience\"]\n\nResume:\n\nContact me at anushka.s@example.com. I'm Anushka Sharma, a UI/UX designer with 3 years at DesignHub, specializing in user flows and prototyping.\n\nOutput JSON:\n{\n  \"name\": \"Anushka Sharma\",\n  \"email\": \"anushka.s@example.com\",\n  \"skills\": [\"UI/UX designer\", \"Prototyping\"],\n  \"experience\": [3, \"3 years at DesignHub\"]\n}"}
{"input": "I have been a solutions engineer at TechBridge for 5 years. I excel at pre-sales and technical demos. - Harish Patel, harish.p@example.com.", "target": {"name": "Harish Patel", "email": "harish.p@example.com", "skills": ["Solutions Engineering", "Pre-sales", "Technical Demos"], "experience": [{"company": "TechBridge", "role": "Solutions Engineer", "years": 5.0}]}, "prediction": {}, "raw_output": "\nExtract structured information from the resume below into JSON with keys:\n[\"name\", \"email\", \"skills\", \"experience\"]\n\nResume:\n\nI have been a solutions engineer at TechBridge for 5 years. I excel at pre-sales and technical demos. - Harish Patel, harish.p@example.com.\n\nOutput JSON:\n{\n  \"name\": \"Harish Patel\",\n  \"email\": \"harish@techbridge.com\",\n  \"skills\": [\"pre-sales\", \"technical demos\"],\n  \"experience\": [\n    {\n      \"name\": \"5 years\",\n      \"email\": \"harish@techbridge.com\",\n      \"skills\": [\"pre-sales\", \"technical demos\"],\n      \"experience\": [\n        {\n          \"name\": \"5 years\",\n          \"email\": \"harish@techbridge.com\",\n          \"skills\": [\"pre-sales\", \"technical demos\"],\n          \"experience\": [\n            {\n              \"name\": \"5 years\",\n              \"email\": \"harish@techbridge.com\",\n              \"skills\": [\"pre-sales\", \"technical demos\"],\n              \"experience\": [\n                {\n                  \"name\": \"5 years\",\n                  \"email\": \"harish@techbridge.com\",\n                  \"skills\": [\"pre-sales\", \"technical demos\"],\n                  \"experience\": [\n                    {\n                      \"name\": \"5 years\",\n                      \"email\": \"harish@techbridge.com\",\n                      \"skills\": [\"pre-sales\", \"technical demos\"],\n                      \"experience"}
{"input": "Nisha Agarwal has been a copywriter at WordSmiths for 1 year. She is skilled in copywriting, editing, and SEO. nisha.a@webmail.com", "target": {"name": "Nisha Agarwal", "email": "nisha.a@webmail.com", "skills": ["Copywriting", "Editing", "SEO"], "experience": [{"company": "WordSmiths", "role": "Copywriter", "years": 1.0}]}, "prediction": {"name": "Nisha Agarwal", "email": "nisha@webmail.com", "skills": ["copywriting", "editing", "SEO"], "experience": [1, 1, 1]}, "raw_output": "\nExtract structured information from the resume below into JSON with keys:\n[\"name\", \"email\", \"skills\", \"experience\"]\n\nResume:\n\nNisha Agarwal has been a copywriter at WordSmiths for 1 year. She is skilled in copywriting, editing, and SEO. nisha.a@webmail.com\n\nOutput JSON:\n{\n  \"name\": \"Nisha Agarwal\",\n  \"email\": \"nisha@webmail.com\",\n  \"skills\": [\"copywriting\", \"editing\", \"SEO\"],\n  \"experience\": [1, 1, 1]\n}"}
{"input": "Aarav Patel here, a Project Manager at QuantumLeap for 8 yrs, proficient in Agile, Scrum, JIRA, and Team Leadership. aarav.p@inbox.com", "target": {"name": "Aarav Patel", "email": "aarav.p@inbox.com", "skills": ["Agile", "Scrum", "JIRA", "Team Leadership"], "experience": [{"company": "QuantumLeap", "role": "Project Manager", "years": 8.0}]}, "prediction": {}, "raw_output": "\nExtract structured information from the resume below into JSON with keys:\n[\"name\", \"email\", \"skills\", \"experience\"]\n\nResume:\n\nAarav Patel here, a Project Manager at QuantumLeap for 8 yrs, proficient in Agile, Scrum, JIRA, and Team Leadership. aarav.p@inbox.com\n\nOutput JSON:\n```json\n{\n  \"name\": \"Aarav Patel\",\n  \"email\": \"aarav.p@inbox.com\",\n  \"skills\": [\"Agile\", \"Scrum\", \"JIRA\", \"Team Leadership\"],\n  \"experience\": [8, 8, 8, 8]\n}\n```"}
{"input": "Fresh grad with marketing internship experience at AdVantage Media (0.5 yrs). Skills in SEO, SEM, and Google Analytics. - Aisha Singh, aisha.s@inbox.com", "target": {"name": "Aisha Singh", "email": "aisha.s@inbox.com", "skills": ["SEO", "SEM", "Google Analytics"], "experience": [{"company": "AdVantage Media", "role": "Marketing Intern", "years": 0.5}]}, "prediction": {"name": "Aisha Singh", "email": "aisha.s@inbox.com", "skills": ["SEO", "SEANET", "Google Analytics"], "experience": [0.5, 1, 2]}, "raw_output": "\nExtract structured information from the resume below into JSON with keys:\n[\"name\", \"email\", \"skills\", \"experience\"]\n\nResume:\n\nFresh grad with marketing internship experience at AdVantage Media (0.5 yrs). Skills in SEO, SEM, and Google Analytics. - Aisha Singh, aisha.s@inbox.com\n\nOutput JSON:\n{\n  \"name\": \"Aisha Singh\",\n  \"email\": \"aisha.s@inbox.com\",\n  \"skills\": [\"SEO\", \"SEANET\", \"Google Analytics\"],\n  \"experience\": [0.5, 1, 2]\n}"}
{"input": "As a Product Manager at Nexus Systems for 10 years, I'm adept at Roadmapping and Market Analysis. Arjun Mehta, arjunm@myemail.com", "target": {"name": "Arjun Mehta", "email": "arjunm@myemail.com", "skills": ["Product Management", "Roadmapping", "Market Analysis"], "experience": [{"company": "Nexus Systems", "role": "Product Manager", "years": 10.0}]}, "prediction": {}, "raw_output": "\nExtract structured information from the resume below into JSON with keys:\n[\"name\", \"email\", \"skills\", \"experience\"]\n\nResume:\n\nAs a Product Manager at Nexus Systems for 10 years, I'm adept at Roadmapping and Market Analysis. Arjun Mehta, arjunm@myemail.com\n\nOutput JSON:\n```json\n{\n  \"name\": \"Arjun Mehta\",\n  \"email\": \"arjunm@myemail.com\",\n  \"skills\": [\"Product Manager\", \"Roadmapping\", \"Market Analysis\"],\n  \"experience\": [10, 10, 10]\n}\n```"}
{"input": "My name is Rani Mukerji. I am a VFX artist with 5 years experience at MagicFrames. My skills include Nuke and After Effects. rani.m@webmail.com.", "target": {"name": "Rani Mukerji", "email": "rani.m@webmail.com", "skills": ["VFX", "Nuke", "After Effects", "Compositing"], "experience": [{"company": "MagicFrames", "role": "VFX Artist", "years": 5.0}]}, "prediction": {"name": "Rani Mukerji", "email": "rani.m@webmail.com", "skills": ["Nuke", "After Effects"], "experience": [5, "5 years"]}, "raw_output": "\nExtract structured information from the resume below into JSON with keys:\n[\"name\", \"email\", \"skills\", \"experience\"]\n\nResume:\n\nMy name is Rani Mukerji. I am a VFX artist with 5 years experience at MagicFrames. My skills include Nuke and After Effects. rani.m@webmail.com.\n\nOutput JSON:\n{\n  \"name\": \"Rani Mukerji\",\n  \"email\": \"rani.m@webmail.com\",\n  \"skills\": [\"Nuke\", \"After Effects\"],\n  \"experience\": [5, \"5 years\"]\n}"}
{"input": "I'm a database administrator. My name is Alok Nath (alok.nath@mail.com). For 9 years at DataVault, I've managed Oracle and MySQL databases.", "target": {"name": "Alok Nath", "email": "alok.nath@mail.com", "skills": ["DBA", "Oracle", "MySQL", "Database Management"], "experience": [{"company": "DataVault", "role": "Database Administrator", "years": 9.0}]}, "prediction": {}, "raw_output": "\nExtract structured information from the resume below into JSON with keys:\n[\"name\", \"email\", \"skills\", \"experience\"]\n\nResume:\n\nI'm a database administrator. My name is Alok Nath (alok.nath@mail.com). For 9 years at DataVault, I've managed Oracle and MySQL databases.\n\nOutput JSON:\n```json\n{\n  \"name\": \"Alok Nath\",\n  \"email\": \"alok.nath@mail.com\",\n  \"skills\": [\"Oracle\", \"MySQL\"],\n  \"experience\": [9, 9]\n}\n```"}
{"input": "My name is Amisha Patel, amisha.p@work.net. I have been a financial controller at MoneyWise for 9 years. I know accounting and financial reporting.", "target": {"name": "Amisha Patel", "email": "amisha.p@work.net", "skills": ["Financial Control", "Accounting", "Financial Reporting"], "experience": [{"company": "MoneyWise", "role": "Financial Controller", "years": 9.0}]}, "prediction": {}, "raw_output": "\nExtract structured information from the resume below into JSON with keys:\n[\"name\", \"email\", \"skills\", \"experience\"]\n\nResume:\n\nMy name is Amisha Patel, amisha.p@work.net. I have been a financial controller at MoneyWise for 9 years. I know accounting and financial reporting.\n\nOutput JSON:\n```json\n{\n  \"name\": \"Amisha Patel\",\n  \"email\": \"amisha.p@work.net\",\n  \"skills\": [\"accounting\", \"financial reporting\"],\n  \"experience\": [9, 9]\n}\n```"}
{"input": "I am a frontend developer with 2 years at CodeFront. I am proficient in Vue.js and TypeScript. My name is Meena Kumari. My email is meena.k@inbox.com.", "target": {"name": "Meena Kumari", "email": "meena.k@inbox.com", "skills": ["Frontend Development", "Vue.js", "TypeScript"], "experience": [{"company": "CodeFront", "role": "Frontend Developer", "years": 2.0}]}, "prediction": {"name": "Meena Kumari", "email": "meena.k@inbox.com", "skills": ["Vue.js", "TypeScript"], "experience": [2, "2 years"]}, "raw_output": "\nExtract structured information from the resume below into JSON with keys:\n[\"name\", \"email\", \"skills\", \"experience\"]\n\nResume:\n\nI am a frontend developer with 2 years at CodeFront. I am proficient in Vue.js and TypeScript. My name is Meena Kumari. My email is meena.k@inbox.com.\n\nOutput JSON:\n{\n  \"name\": \"Meena Kumari\",\n  \"email\": \"meena.k@inbox.com\",\n  \"skills\": [\"Vue.js\", \"TypeScript\"],\n  \"experience\": [2, \"2 years\"]\n}"}
{"input": "For 7 years, I, Kareena Kapoor, have been an event manager at EventMasters. My skills include event planning and budget management. Email: kareena.k@inbox.com.", "target": {"name": "Kareena Kapoor", "email": "kareena.k@inbox.com", "skills": ["Event Management", "Event Planning", "Budget Management"], "experience": [{"company": "EventMasters", "role": "Event Manager", "years": 7.0}]}, "prediction": {}, "raw_output": "\nExtract structured information from the resume below into JSON with keys:\n[\"name\", \"email\", \"skills\", \"experience\"]\n\nResume:\n\nFor 7 years, I, Kareena Kapoor, have been an event manager at EventMasters. My skills include event planning and budget management. Email: kareena.k@inbox.com.\n\nOutput JSON:\n```json\n{\n  \"name\": \"Kareena Kapoor\",\n  \"email\": \"kareena.k@inbox.com\",\n  \"skills\": [\"event planning and budget management\"],\n  \"experience\": [7, \"years\"]\n}\n```"}
